{
  "meta": {
    "title": "Great Library of SISO · landing",
    "description": "The root front door: purpose in his words, the ecosystem loop, counts from catalog.json, featured Works, what moved, the nine sections.",
    "stream": "projects",
    "crumb": [
      {
        "label": "Templates",
        "href": "/"
      },
      {
        "label": "U1 · Library landing",
        "href": "/t/U1/"
      },
      {
        "label": "example"
      }
    ],
    "actions": [
      {
        "label": "Live root",
        "href": "https://great-library-of-siso.pages.dev/",
        "icon": "arrow-up-right",
        "external": true
      },
      {
        "label": "catalog.json",
        "href": "https://great-library-of-siso.pages.dev/catalog.json",
        "icon": "file-json",
        "external": true
      }
    ],
    "source": "https://great-library-of-siso.pages.dev/catalog.json generated 2026-09-06T06:50Z · GOD-QUESTIONS.md · INTENT.md · OWNERS.md"
  },
  "heading": {
    "kicker": "the great library of siso <span class=\"sep\">·</span> open knowledge <span class=\"sep\">·</span> <span class=\"dim\">catalog.json 2026-09-06 06:50Z</span>",
    "title": "Great Library of SISO",
    "subtitle": "The public registry and reading surface for SISO research, software and agent systems. The bet in one line: give every small and medium business the operating system only the biggest companies can afford today, by turning open-source code and the best available intelligence into working systems. <span class=\"faint\">(INTENT.md)</span>",
    "badges": [
      {
        "label": "47 Works",
        "tone": "projects",
        "href": "https://great-library-of-siso.pages.dev/works/"
      },
      {
        "label": "86 Releases",
        "tone": "projects",
        "href": "https://great-library-of-siso.pages.dev/releases/"
      },
      {
        "label": "40 Snapshots",
        "tone": "muted",
        "href": "https://great-library-of-siso.pages.dev/snapshots/"
      },
      {
        "label": "27 repos · 23 public · 4 private",
        "tone": "clients",
        "href": "https://great-library-of-siso.pages.dev/estate/"
      },
      {
        "label": "22 God Questions",
        "tone": "research",
        "href": "https://great-library-of-siso.pages.dev/god-questions/"
      },
      {
        "label": "17 industries",
        "tone": "clients",
        "href": "https://great-library-of-siso.pages.dev/industries/"
      }
    ],
    "status": {
      "kicker": "Moved this week",
      "value": "13 commits · 5 Sep 17:00 → 6 Sep 13:42",
      "note": "Root and Foundry pilot on Cloudflare Pages (ADR-0006), publish + register plays, V39 spine, GQ-012–019 pages, Foundry readers, Action Model Work. The shell and templates now come from siso-shell.",
      "facts": [
        {
          "k": "head",
          "v": "<code>477b775</code> · 6 Sep 13:42"
        },
        {
          "k": "owner",
          "v": "LIBRARY-ZERO · idle 12:52"
        },
        {
          "k": "search",
          "v": "<kbd>⌘K</kbd> in the rail"
        }
      ]
    },
    "metrics": [
      {
        "value": 7,
        "label": "featured records",
        "tone": "projects",
        "href": "#featured"
      },
      {
        "value": 6,
        "label": "dated OWNERS lines",
        "tone": "agents",
        "href": "#moved"
      },
      {
        "value": 9,
        "label": "Library sections",
        "tone": "muted",
        "href": "#sections"
      }
    ],
    "jump": [
      {
        "label": "Purpose, in his words",
        "href": "#purpose"
      },
      {
        "label": "The loop",
        "href": "#loop"
      },
      {
        "label": "Counts",
        "href": "#counts"
      },
      {
        "label": "Featured",
        "href": "#featured"
      },
      {
        "label": "What moved",
        "href": "#moved"
      },
      {
        "label": "The sections",
        "href": "#sections"
      }
    ]
  },
  "sections": {
    "purpose": {
      "n": "01",
      "title": "Purpose, in his words",
      "sub": "verbatim, dated"
    },
    "loop": {
      "n": "02",
      "title": "The loop",
      "sub": "clients fund compute → owners build → packs enter the Library → people + repos feed Foundry → questions turn evidence into breakthroughs → better client outcomes. Every node is a link; 'measured' only where a receipt exists."
    },
    "counts": {
      "n": "03",
      "title": "Counts",
      "sub": "equal to catalog.json at build"
    },
    "featured": {
      "n": "04",
      "title": "Featured",
      "sub": "latest Works · latest God Questions · latest project one pagers"
    },
    "moved": {
      "n": "05",
      "title": "What moved",
      "sub": "latest owner writebacks"
    },
    "sections": {
      "n": "06",
      "title": "The sections"
    },
    "agent": {
      "n": "07",
      "title": "Agent entry"
    }
  },
  "words": [
    {
      "text": "we need a bit more of a nicer information front-end system like i'm ai it's all written in code but i need a way to actually see that shit so i i guess that's what the great library is",
      "who": "Shaan → AGENT-ZERO",
      "at": "6 Sep 16:36"
    },
    {
      "text": "look at what we currently have and figure out why it's stupid",
      "who": "Shaan → AGENT-ZERO",
      "at": "6 Sep 16:36"
    },
    {
      "text": "each module should have a standardized page which is a bit better so like you can have the library with everything but each one should have its own page which is a bit nicer like when i click on one like we should just put some reasoning on it",
      "who": "Shaan → Fable FA0",
      "at": "5 Sep 19:15"
    }
  ],
  "loop": [
    {
      "label": "Clients fund compute",
      "what": "ofm · bykonz · actionmodel",
      "href": "/t/U15/",
      "tone": "clients"
    },
    {
      "label": "Owners build industry systems",
      "what": "one seat per project; 11 projects",
      "href": "/t/U4/example/",
      "tone": "projects"
    },
    {
      "label": "Packs enter the Library",
      "what": "47 Works · 86 Releases · 40 Snapshots · 2 Assemblies",
      "href": "https://great-library-of-siso.pages.dev/works/",
      "tone": "projects"
    },
    {
      "label": "People + repos feed Foundry",
      "what": "27 repos · 17 industries · 8 inventories",
      "href": "https://great-library-of-siso.pages.dev/industries/",
      "tone": "clients"
    },
    {
      "label": "Questions turn evidence into breakthroughs",
      "what": "22 God Questions · compute runs with receipts",
      "href": "https://great-library-of-siso.pages.dev/god-questions/",
      "tone": "research",
      "measured": "J2 · ratio 1.00× · n=1"
    },
    {
      "label": "Better client outcomes",
      "what": "framework replicated industry by industry",
      "href": "https://great-library-of-siso.pages.dev/industries/law_firms/",
      "tone": "now"
    }
  ],
  "metrics": [
    {
      "value": 47,
      "label": "Works",
      "tone": "projects",
      "href": "https://great-library-of-siso.pages.dev/works/"
    },
    {
      "value": 86,
      "label": "Releases",
      "tone": "projects",
      "href": "https://great-library-of-siso.pages.dev/releases/"
    },
    {
      "value": 40,
      "label": "Snapshots",
      "tone": "muted",
      "href": "https://great-library-of-siso.pages.dev/snapshots/"
    },
    {
      "value": 2,
      "label": "Assemblies",
      "tone": "muted",
      "href": "https://great-library-of-siso.pages.dev/promotion/"
    },
    {
      "value": 8,
      "label": "Source inventories",
      "tone": "muted",
      "href": "https://great-library-of-siso.pages.dev/promotion/"
    },
    {
      "value": 27,
      "label": "repos · 23 public · 4 private",
      "tone": "clients",
      "href": "https://great-library-of-siso.pages.dev/estate/"
    },
    {
      "value": 22,
      "label": "God Questions (9 real pages)",
      "tone": "research",
      "href": "https://great-library-of-siso.pages.dev/god-questions/"
    },
    {
      "value": 17,
      "label": "industries",
      "tone": "clients",
      "href": "https://great-library-of-siso.pages.dev/industries/"
    },
    {
      "value": 47,
      "label": "Events · 6 decisions · 3 initiatives",
      "tone": "agents",
      "href": "https://great-library-of-siso.pages.dev/intelligence/"
    }
  ],
  "breakdowns": [
    {
      "label": "Works by type",
      "chips": [
        {
          "label": "research_question · 18",
          "tone": "research"
        },
        {
          "label": "knowledge_system · 8",
          "tone": "research"
        },
        {
          "label": "bundle · 4",
          "tone": "muted"
        },
        {
          "label": "project · 3",
          "tone": "projects"
        },
        {
          "label": "tool · 3",
          "tone": "projects"
        },
        {
          "label": "section · 2",
          "tone": "muted"
        },
        {
          "label": "agent_system · 2",
          "tone": "agents"
        },
        {
          "label": "capability_pack · 2",
          "tone": "agents"
        },
        {
          "label": "playbook · 2",
          "tone": "agents"
        },
        {
          "label": "application · 2",
          "tone": "projects"
        },
        {
          "label": "library · 1",
          "tone": "projects"
        }
      ]
    },
    {
      "label": "Works by maturity",
      "chips": [
        {
          "label": "active · 28",
          "tone": "now",
          "dot": true
        },
        {
          "label": "experimental · 17",
          "tone": "warn"
        },
        {
          "label": "planned · 1",
          "tone": "muted"
        },
        {
          "label": "retired · 1",
          "tone": "blocked"
        }
      ]
    },
    {
      "label": "Works by section",
      "chips": [
        {
          "label": "Research · 17",
          "tone": "research"
        },